name,price
Краска-эмаль ЭП-5327 (для дорожной разметки) в Краснодаре,270
Эмаль МС-17 чёрная (ТУ 6-10-1012-97) в Краснодаре,300
Эмаль (Краска) АК-124 (ГОСТ Р 51691-2008) в Краснодаре,220
Эмаль ПФ-1189 серебристая (ТУ 6-10-1710-86) в Краснодаре,260
Эмаль ХС-75У (ТУ 6-10-2136-88) в Краснодаре,135
Эмаль ХВ-519 защитная (ТУ 6-10-838-75) в Краснодаре,215
Эмаль ЭП-46 в Краснодаре,320
Эмаль ХВ-7141 (двухкомпонентная) в Краснодаре,330
Эмаль ХВ-125 серебристая (ТУ) в Краснодаре,235
Краска-эмаль ЭП-5155 (для дорожной разметки) в Краснодаре,315
Эмаль ХС-76У в Краснодаре,230
Краска для бетонных полов глянцевая (ТУ 2313-022-98310821-09) в Краснодаре,480
Эмаль ЭП-255 фисташковая (ГОСТ 23599-79) в Краснодаре,235
Эмаль ЭП-567 белая (ГОСТ 22369-77) в Краснодаре,330
Эмаль ХВ-714 чёрная (ГОСТ 23626-79) в Краснодаре,220
Эмаль ЭП-1155 чёрная (ТУ 6-10-1504-75) в Краснодаре,285
Эмаль ЭП-969 салатная (ТУ 6-10-1985-84) в Краснодаре,345
Эмаль ХВ-714 защитная (ГОСТ 23626-79) в Краснодаре,220
Эмаль ЭП-255 желтая (ГОСТ 23599-79) в Краснодаре,235
Эмаль ЭП-275 зелёная (ГОСТ 23599-79) в Краснодаре,285
Эмаль ЭП-255 красно-коричневая (ГОСТ 23599-79) в Краснодаре,235
Эмаль ЭП-275 синяя (ГОСТ 23599-79) в Краснодаре,285
Эмаль ЭП-275 коричневая (ГОСТ 23599-79) в Краснодаре,285
Эмаль ЭП-1155 салатовая (ТУ 6-10-1504-75) в Краснодаре,285
Краска фасадная зимняя до -15°С (ГОСТ 28196-89) в Краснодаре,200
Эмаль ЭП-275 жёлтая (ГОСТ 23599-79) в Краснодаре,285
Эмаль ЭП-255 серая (ГОСТ 23599-79) в Краснодаре,235
Эмаль ЭП-275 оранжевая (ГОСТ 23599-79) в Краснодаре,285
Эмаль ЭП-5116 красно-коричневая (ГОСТ 25366-82) в Краснодаре,210
Эмаль ЭП-1155 синяя (ТУ 6-10-1504-75) в Краснодаре,285
Эмаль ХВ-714 серая (ГОСТ 23626-79) в Краснодаре,220
Эмаль ЭП-567 красная (ГОСТ 22369-77) в Краснодаре,330
Эмаль ЭП-5116 светло-серая (ГОСТ 25366-82) в Краснодаре,210
Эмаль ЭП-5116 защитная (ГОСТ 25366-82) в Краснодаре,210
Эмаль ЭП-5116 чёрная (ГОСТ 25366-82) в Краснодаре,210
Эмаль ЭП-5116 зеленая (ГОСТ 25366-82) в Краснодаре,210
Эмаль ЭП-275 красно-коричневая (ГОСТ 23599-79) в Краснодаре,285
Эмаль ЭП-255 защитная (ГОСТ 23599-79) в Краснодаре,235
Эмаль ЭП-5116 синяя (ГОСТ 25366-82) в Краснодаре,210
Эмаль ЭП-255 оранжевая (ГОСТ 23599-79) в Краснодаре,235
Эмаль ХВ-714 красно-коричневая (ГОСТ 23626-79) в Краснодаре,220
Эмаль ЭП-5116 серая (ГОСТ 25366-82) в Краснодаре,210
Эмаль ЭП-1155 защитная (ТУ 6-10-1504-75) в Краснодаре,285
Эмаль ЭП-275 салатовая (ГОСТ 23599-79) в Краснодаре,285
Эмаль ХВ-714 синяя (ГОСТ 23626-79) в Краснодаре,220
Эмаль ЭП-255 зеленая (ГОСТ 23599-79) в Краснодаре,235
Эмаль ХВ-714 светло-серая (ГОСТ 23626-79) в Краснодаре,220
Эмаль ЭП-275 серая (ГОСТ 23599-79) в Краснодаре,285
Эмаль ХВ-714 коричневая (ГОСТ 23626-79) в Краснодаре,220
Эмаль ЭП-1155 серая (ТУ 6-10-1504-75) в Краснодаре,285
Эмаль ХВ-714 оранжевая (ГОСТ 23626-79) в Краснодаре,220
Эмаль ЭП-1155 коричневая (ТУ 6-10-1504-75) в Краснодаре,285
Эмаль ЭП-255 коричневая (ГОСТ 23599-79) в Краснодаре,235
Эмаль ЭП-1155 белая (ТУ 6-10-1504-75) в Краснодаре,285
Эмаль ХВ-714 салатовая (ГОСТ 23626-79) в Краснодаре,220
Эмаль ЭП-567 защитная (ГОСТ 22369-77) в Краснодаре,330
Эмаль ЭП-5116 оранжевая (ГОСТ 25366-82) в Краснодаре,210
Эмаль ЭП-255 чёрная (ГОСТ 23599-79) в Краснодаре,235
Эмаль ЭП-5116 голубая (ГОСТ 25366-82) в Краснодаре,210
Эмаль ЭП-1155 зелёная (ТУ 6-10-1504-75) в Краснодаре,285
Эмаль АС-5307 (СТП 6-3-121-2001) в Краснодаре,220
Эмаль ЭП-1155 голубая (ТУ 6-10-1504-75) в Краснодаре,285
Эмаль ЭП-1155 оранжевая (ТУ 6-10-1504-75) в Краснодаре,285
Эмаль ЭП-275 белая (ГОСТ 23599-79) в Краснодаре,285
Эмаль ЭП-567 голубая (ГОСТ 22369-77) в Краснодаре,330
Эмаль ЭП-567 серая (ГОСТ 22369-77) в Краснодаре,330
Эмаль ЭП-5116 белая (ГОСТ 25366-82) в Краснодаре,210
Эмаль ЭП-5116 желтая (ГОСТ 25366-82) в Краснодаре,210
Эмаль ЭП-1155 красная (ТУ 6-10-1504-75) в Краснодаре,285
Эмаль ЭП-1155 фисташковая (ТУ 6-10-1504-75) в Краснодаре,285
Эмаль ХВ-714 белая (ГОСТ 23626-79) в Краснодаре,220
Эмаль ЭП-567 фисташковая (ГОСТ 22369-77) в Краснодаре,330
Эмаль ЭП-5116 бежевая (ГОСТ 25366-82) в Краснодаре,210
Эмаль ЭП-275 фисташковая (ГОСТ 23599-79) в Краснодаре,285
Эмаль ЭП-275 светло-серая (ГОСТ 23599-79) в Краснодаре,285
Эмаль ЭП-1155 светло-серая (ТУ 6-10-1504-75) в Краснодаре,285
Эмаль ЭП-1155 красно-коричневая (ТУ 6-10-1504-75) в Краснодаре,285
Эмаль ЭП-275 защитная (ГОСТ 23599-79) в Краснодаре,285
Эмаль ЭП-567 чёрная (ГОСТ 22369-77) в Краснодаре,330
Эмаль ЭП-275 красная (ГОСТ 23599-79) в Краснодаре,285
Эмаль ЭП-567 оранжевая (ГОСТ 22369-77) в Краснодаре,330
Эмаль ХВ-714 жёлтая (ГОСТ 23626-79) в Краснодаре,220
Эмаль ЭП-1155 жёлтая (ТУ 6-10-1504-75) в Краснодаре,285
Эмаль ЭП-5116 салатовая (ГОСТ 25366-82) в Краснодаре,210
Эмаль ЭП-1155 бежевая (ТУ 6-10-1504-75) в Краснодаре,285
Эмаль ХВ-714 голубая (ГОСТ 23626-79) в Краснодаре,220
Эмаль ЭП-275 бежевая (ГОСТ 23599-79) в Краснодаре,285
Эмаль ЭП-567 светло-серая (ГОСТ 22369-77) в Краснодаре,330
Эмаль ХВ-714 зелёная (ГОСТ 23626-79) в Краснодаре,220
Эмаль ЭП-567 бежевая (ГОСТ 22369-77) в Краснодаре,330
Эмаль ЭП-255 светло-серая (ГОСТ 23599-79) в Краснодаре,235
Эмаль ЭП-567 коричневая (ГОСТ 22369-77) в Краснодаре,330
Эмаль ЭП-567 зелёная (ГОСТ 22369-77) в Краснодаре,330
Эмаль ЭП-275 голубая (ГОСТ 23599-79) в Краснодаре,285
Эмаль ЭП-567 синяя (ГОСТ 22369-77) в Краснодаре,330
Эмаль ЭП-567 салатовая (ГОСТ 22369-77) в Краснодаре,330
Эмаль ХВ-714 красная (ГОСТ 23626-79) в Краснодаре,220
Эмаль ЭП-5116 коричневая (ГОСТ 25366-82) в Краснодаре,210
Эмаль ЭП-567 жёлтая (ГОСТ 22369-77) в Краснодаре,330
Эмаль ЭП-255 голубая (ГОСТ 23599-79) в Краснодаре,235
Эмаль ПФ-218 ХС (ГОСТ 21227-93) в Краснодаре,205
Эмаль ГФ-92 ХС (ГОСТ 9151-75) в Краснодаре,210
Эмаль МЛ-12 серая (ГОСТ 9754-76) в Краснодаре,240
Эмаль ЭП-773 1К (ГОСТ 23143-83) в Краснодаре,235
Краска БТ-177 (ГОСТ 5631-79) в Краснодаре,205
Холодный термопластик дорожный в Краснодаре,220
Краска термопластик для дорожной разметки в Краснодаре,290
Отвердитель к эмалям МЛ в Краснодаре,450
Эмаль АК-575 (ТУ 20.30.22-002-83706890-2008) в Краснодаре,380
Стеклошарики в Краснодаре,130
Эмаль ХП-799 (ТУ 6-10-1653-78) в Краснодаре,330
Эмаль ЭП-9111 (ТУ 20.30.22-002-83706890-2008) в Краснодаре,295
ИЗУР-021 в Краснодаре,1200
Эмаль ХВ-714 бежевая (ГОСТ 23626-79) в Краснодаре,220
Эмаль ЭП-255 белая (ГОСТ 23599-79) в Краснодаре,235
Эмаль ЭП-567 красно-коричневая (ГОСТ 22369-77) в Краснодаре,330
Эмаль ХВ-161 синяя (ТУ 301-10-908-92) в Краснодаре,200
Эмаль НЦ-132 серая (ГОСТ Р 51691-2008) в Краснодаре,215
Эмаль ХВ-161 серая (ТУ 301-10-908-92) в Краснодаре,200
Эмаль НЦ-5123 (ГОСТ 7462-73) в Краснодаре,230
Эмаль МЛ-1110 серая (ГОСТ 20481-80) в Краснодаре,240
Эмаль ПФ-115 ЭКОНОМ серая (ГОСТ 6465-76) в Краснодаре,115
Эмаль НЦ-184 (ГОСТ 18335-83) в Краснодаре,235
Эмаль АК-511 белая (ГОСТ Р 52575-2006) в Краснодаре,170
Эмаль МЛ-1110 белая (ГОСТ 20481-80) в Краснодаре,240
Эмаль ПФ-1217 ВЭ (ТУ 20.30.22-002-83706890-2008) в Краснодаре,240
Эмаль ХВ-16 серая (ТУ 6-10-1301-83) в Краснодаре,200
Эмаль ХВ-124 серая (ГОСТ 10144-89) в Краснодаре,200
Эмаль ПФ-167 (ТУ 20.30.22-002-83706890-2008) в Краснодаре,185
Эмаль КО-174 серая (ТУ 6-02-576-87) в Краснодаре,180
Эмаль ХВ-785 серая (ГОСТ 7313-75)  в Краснодаре,200
Эмаль МЛ-1100 серая (ТУ 20.30.22-002-83706890-2008) в Краснодаре,240
Эмаль ПФ-115 ЭКОНОМ желтая (ГОСТ 6465-76) в Краснодаре,115
Эмаль КО-814 серебристо-серая до +400°C (ГОСТ 11066-74) в Краснодаре,300
Эмаль МЛ-12 светло-дымчатая (ГОСТ 9754-76) в Краснодаре,240
Эмаль МЛ-12 синяя (ГОСТ 9754-76) в Краснодаре,240
Эмаль ПФ-1189 серебристая (ТУ 6-10-1710-86) в Краснодаре,260
Эмаль МЛ-12 защитная (ГОСТ 9754-76) в Краснодаре,240
Эмаль МЛ-12 черная (ГОСТ 9754-76) в Краснодаре,240
Эмаль МЛ-12 желтая (ГОСТ 9754-76) в Краснодаре,240
Эмаль ХВ-16 белая (ТУ 6-10-1301-83) в Краснодаре,200
Эмаль МЛ-12 белая (ГОСТ 9754-76) в Краснодаре,240
Эмаль МЛ-12 красная (ГОСТ 9754-76) в Краснодаре,240
Эмаль ХВ-124 белая (ГОСТ 10144-89) в Краснодаре,200
Эмаль ПФ-115 ЭКОНОМ белая (ГОСТ 6465-76) в Краснодаре,125
Эмаль ПФ-115 ЭКОНОМ защитная (ГОСТ 6465-76) в Краснодаре,115
Эмаль ПФ-115 ЭКОНОМ бежевая (ГОСТ 6465-76) в Краснодаре,115
Эмаль АК-511 желтая (ГОСТ Р 52575-2006) в Краснодаре,170
Эмаль ПФ-115 ЭКОНОМ коричневая (ГОСТ 6465-76) в Краснодаре,115
Эмаль ХВ-785 красная (ГОСТ 7313-75)  в Краснодаре,200
Эмаль ХВ-124 зеленая (ГОСТ 10144-89) в Краснодаре,200
Эмаль ХВ-124 красная (ГОСТ 10144-89) в Краснодаре,200
Эмаль ПФ-115 ЭКОНОМ белая матовая (ГОСТ 6465-76) в Краснодаре,125
Эмаль МЛ-12 светло-голубая (ГОСТ 9754-76) в Краснодаре,240
Эмаль МЛ-12 ярко-зеленая (ГОСТ 9754-76) в Краснодаре,240
Эмаль МЛ-12 песочная (ГОСТ 9754-76) в Краснодаре,240
Эмаль МЛ-12 светло-серая (ГОСТ 9754-76) в Краснодаре,240
Эмаль МЛ-12 морская волна (ГОСТ 9754-76) в Краснодаре,240
Эмаль МЛ-12 коричневая (ГОСТ 9754-76) в Краснодаре,240
Эмаль МЛ-12 голубая (ГОСТ 9754-76) в Краснодаре,240
Эмаль НЦ-132 белая (ГОСТ Р 51691-2008) в Краснодаре,215
Эмаль ХВ-124 салатовая (ГОСТ 10144-89) в Краснодаре,200
Эмаль ПФ-115 ЭКОНОМ красная (ГОСТ 6465-76) в Краснодаре,115
Эмаль ХВ-124 голубая (ГОСТ 10144-89) в Краснодаре,200
Эмаль ХВ-16 зеленая (ТУ 6-10-1301-83) в Краснодаре,200
Эмаль ПФ-115 ЭКОНОМ черная (ГОСТ 6465-76) в Краснодаре,115
Эмаль НЦ-132 золотисто-желтая (ГОСТ Р 51691-2008) в Краснодаре,215
Эмаль ХВ-124 светло-серая (ГОСТ 10144-89) в Краснодаре,200
Эмаль МЛ-1110 красная (ГОСТ 20481-80) в Краснодаре,240
Эмаль КО-174 черная (ТУ 6-02-576-87) в Краснодаре,180
Эмаль ХВ-161 желтая (ТУ 301-10-908-92) в Краснодаре,200
Эмаль ПФ-115 ЭКОНОМ светло-серая (ГОСТ 6465-76) в Краснодаре,115
Эмаль МЛ-12 серо-голубая (ГОСТ 9754-76) в Краснодаре,240
Эмаль ХВ-124 синяя (ГОСТ 10144-89) в Краснодаре,200
Эмаль ХВ-124 желтая (ГОСТ 10144-89) в Краснодаре,200
Эмаль КО-198 защитная (ТУ 6-02-841-74) в Краснодаре,180
Эмаль ХВ-16 голубая (ТУ 6-10-1301-83) в Краснодаре,200
Эмаль ХВ-785 светло-серая (ГОСТ 7313-75)  в Краснодаре,200
Эмаль НЦ-132 зеленая (ГОСТ Р 51691-2008) в Краснодаре,215
Эмаль МЛ-1110 защитная (ГОСТ 20481-80) в Краснодаре,240
Эмаль КО-198 синяя (ТУ 6-02-841-74) в Краснодаре,180
Краска БТ-177 серебристая (ГОСТ 5631-79) в Краснодаре,205
Эмаль КО-198 золотисто-желтая (ТУ 6-02-841-74) в Краснодаре,180
Эмаль ХВ-785 белая (ГОСТ 7313-75)  в Краснодаре,200
Эмаль АК-511 черная (ГОСТ Р 52575-2006) в Краснодаре,170
Эмаль ХВ-161 светло-серая (ТУ 301-10-908-92) в Краснодаре,200
Эмаль НЦ-132 голубая (ГОСТ Р 51691-2008) в Краснодаре,215
Эмаль ПФ-115 ЭКОНОМ синяя (ГОСТ 6465-76) в Краснодаре,115
Эмаль ХВ-16 красная (ТУ 6-10-1301-83) в Краснодаре,200
Эмаль ХВ-16 черная (ТУ 6-10-1301-83) в Краснодаре,200
Эмаль ХВ-161 зеленая (ТУ 301-10-908-92) в Краснодаре,200
Эмаль ХВ-785 желтая (ГОСТ 7313-75)  в Краснодаре,200
Эмаль ХВ-785 черная (ГОСТ 7313-75)  в Краснодаре,200
Эмаль ПФ-115 ЭКОНОМ голубая (ГОСТ 6465-76) в Краснодаре,115
Эмаль ХВ-124 защитная (ГОСТ 10144-89) в Краснодаре,200
Эмаль ХВ-16 желтая (ТУ 6-10-1301-83) в Краснодаре,200
Эмаль НЦ-132 оранжевая (ГОСТ Р 51691-2008) в Краснодаре,215
Эмаль КО-198 серая (ТУ 6-02-841-74) в Краснодаре,180
Эмаль ХВ-785 зеленая (ГОСТ 7313-75)  в Краснодаре,200
Эмаль НЦ-132 черная (ГОСТ Р 51691-2008) в Краснодаре,215
Эмаль ХВ-16 оранжевая (ТУ 6-10-1301-83) в Краснодаре,200
Эмаль КО-813 серебристо-серая до +500°С (ГОСТ 11066-74) в Краснодаре,300
Эмаль ХВ-124 коричневая (ГОСТ 10144-89) в Краснодаре,200
Эмаль ПФ-115 ЭКОНОМ оранжевая (ГОСТ 6465-76) в Краснодаре,115
Эмаль ПФ-115 ЭКОНОМ салатовая (ГОСТ 6465-76) в Краснодаре,115
Эмаль ХВ-785 оранжевая (ГОСТ 7313-75)  в Краснодаре,200
Эмаль ХВ-161 белая (ТУ 301-10-908-92) в Краснодаре,200
Эмаль МЛ-1110 зеленая (ГОСТ 20481-80) в Краснодаре,240
Эмаль КО-174 красная (ТУ 6-02-576-87) в Краснодаре,180
Эмаль ПФ-115 ЭКОНОМ зеленая (ГОСТ 6465-76) в Краснодаре,115
Краска МА-15 белая (ГОСТ 10503-71) в Краснодаре,145
Эмаль МЛ-1110 оранжевая (ГОСТ 20481-80) в Краснодаре,240
Эмаль КО-174 защитная (ТУ 6-02-57-87) в Краснодаре,180
Эмаль ХВ-124 красно-коричневая (ГОСТ 10144-89) в Краснодаре,200
Эмаль КО-198 зеленая (ТУ 6-02-841-74) в Краснодаре,180
Эмаль КО-198 коричневая (ТУ 6-02-841-74) в Краснодаре,180
Эмаль КО-198 черная (ТУ 6-02-841-74) в Краснодаре,180
Эмаль ХВ-124 оранжевая (ГОСТ 10144-89) в Краснодаре,200
Эмаль ПФ-115 ЭКОНОМ красно-коричневая (ГОСТ 6465-76) в Краснодаре,115
Эмаль КО-198 желтая (ТУ 6-02-841-74) в Краснодаре,180
Эмаль ХС-759 1К (ГОСТ 23494-79) в Краснодаре,260
Эмаль КО-813 серебристо-серая до +500°С (ГОСТ 11066-74) в Краснодаре,300
Эмаль ХВ-124 (ГОСТ 10144-89) в Краснодаре,200
Эмаль ЭП-1236 1К (ГОСТ 23143-83) в Краснодаре,235
Эмаль ХС-436 (ТУ 20.30.22-002-83706890-2008) в Краснодаре,320
Краска МА-22 (ГОСТ 10503-71) в Краснодаре,145
Эмаль ЭП-51 (ГОСТ 9640-85) в Краснодаре,320
Эмаль КО-8101 серебристо-серая до +600°С (ТУ 6-10-959-75) в Краснодаре,370
Эмаль КО-811 до +200°C (+400°С) (ГОСТ 23122-78) в Краснодаре,225
Краска-эмаль АК-511 (для дорожной разметки) (ГОСТ Р 52575-2006) в Краснодаре,170
Эмаль ПФ-133 (ГОСТ 926-82) в Краснодаре,175
Краска МА-15 сурик (ГОСТ 10503-71) в Краснодаре,145
Эмаль ПФ-115 цветная ЭКОНОМ (ГОСТ 6465-76) в Краснодаре,115
Эмаль ЭП-275 (ГОСТ 23599-79) в Краснодаре,285
Эмаль КО-870 серебристо-серая до +600°С в Краснодаре,370
Эмаль КО-88 серебристо-серая до +500°С (ГОСТ 23101-78) в Краснодаре,290
Эмаль ЭП-5116 1К (ГОСТ 25366-82) в Краснодаре,210
Эмаль НЦ-132 (ГОСТ Р 51691-2008) в Краснодаре,215
Эмаль ХВ-518 У-1 защитная (ТУ 6-10-966-75) в Краснодаре,230
Эмаль ЭП-1155 (ТУ 6-10-1504-75) в Краснодаре,285
Эмаль МС-17 (ТУ 6-10-1012-97) в Краснодаре,300
Эмаль ПФ-266 (ГОСТ Р 51691-2008) в Краснодаре,150
Эмаль ХВ-785 (ГОСТ 7313-75) в Краснодаре,200
Эмаль ЭП-969 салатная (ТУ 6-10-1985-84) в Краснодаре,345
Эмаль НЦ-25 (ГОСТ 5406-84) в Краснодаре,210
Эмаль КО-814 серебристо-серая до +400°С (ГОСТ 11066-74) в Краснодаре,300
Эмаль НЦ-11 (ГОСТ 9198-83) в Краснодаре,230
Эмаль ЭП-525 1К (ГОСТ 22438-85) в Краснодаре,235
Эмаль ЭП-5285 (ТУ 95-2184-90) в Краснодаре,315
Эмаль КО-8111 серебристо-серая до +600°С (ТУ 20.30.22-002-83706890-2008) в Краснодаре,370
Эмаль ЭП-1294 (ТУ 6-21-69-92) в Краснодаре,285
Эмаль АУ-1518Р (ТУ 20.30.22-002-83706890-2008) в Краснодаре,280
Эмаль ХВ-16 (ТУ 6-10-1301-83) в Краснодаре,200
Эмаль ХВ-113 (ГОСТ 18374-79) в Краснодаре,215
Эмаль ВЛ-515 (ТУ 6-10-1052-75) в Краснодаре,265
Эмаль МЛ-165 без молоткового эффекта (ГОСТ 12034-77) в Краснодаре,305
Эмаль ГФ-1426 защитная (ГОСТ 6745-79) в Краснодаре,200
Эмаль ХВ-1100 (ГОСТ 6993-79) в Краснодаре,210
Эмаль КО-983 красно-коричневая (ТУ 16-89479.0275.001) в Краснодаре,290
Эмаль Полиуретановая (ТУ 20.30.22-002-83706890-2008) в Краснодаре,470
Эмаль ХВ-110 (ГОСТ 18374-79) в Краснодаре,215
Эмаль АС-182 (ГОСТ 19024-79) в Краснодаре,220
Эмаль ХВ-1120 (ТУ 6-10-1227-77) в Краснодаре,210
Эмаль ХС-717 с алюминиевой пудрой (ТУ 6-27-102-99) в Краснодаре,320
Эмаль ХС-710 (ГОСТ 9355-81) в Краснодаре,235
Эмаль ЭП-5287 (ТУ 6-21-87-97) в Краснодаре,310
Эмаль СП-1266С красно-коричневая (ТУ 301-10-031-90) в Краснодаре,220
Эмаль КО-1243 (ТУ 420-422-86) в Краснодаре,180
Эмаль КО-1112 (ТУ 20.30.22-002-83706890-2008) в Краснодаре,180
Эмаль КО-1012 (ТУ 20.30.22-002-83706890-2008) в Краснодаре,180
Эмаль ХВ-714 (ГОСТ 23626-79) в Краснодаре,220
Эмаль ХВ-1110 (ГОСТ 6993-79) в Краснодаре,210
Эмаль ЭП-255 1К (ГОСТ 23599-79) в Краснодаре,235
Эмаль МЛ-1110 (ГОСТ 20481-80) в Краснодаре,240
Эмаль АУ-167 (ТУ 20.30.22-002-83706890-2008) в Краснодаре,195
Эмаль КО-868 серебристо-серая до +600°С (ТУ 20.30.22-002-83706890-2008) в Краснодаре,370
Эмаль КО-174 (ТУ 6-02-576-87) в Краснодаре,180
Эмаль КО-8104 серебристо-серая до +600°С (ТУ 20.30.22-002-83706890-2008) в Краснодаре,370
Эмаль ЭП-1143 (ТУ 6-10-11-ВИАМ-95-88) в Краснодаре,300
Эмаль ПФ-188 (ГОСТ 24784-81) в Краснодаре,190
Эмаль МЛ-1100 (ТУ 20.30.22-002-83706890-2008) в Краснодаре,240
Эмаль ЭП-140 1К (ГОСТ 24709-81) в Краснодаре,210
Краска МА-25 (ГОСТ 10503-71) в Краснодаре,145
