name,price
Эмаль МЛ-12 (ГОСТ 9754-76) в Краснодаре,240
Эмаль МЛ-1100 серо-голубая (ТУ 20.30.22-002-83706890-2008) в Краснодаре,240
Краска МА-25 чёрная (ГОСТ 10503-71) в Краснодаре,145
Эмаль ХВ-1120 белая (ТУ 6-10-1227-77) в Краснодаре,210
Эмаль НЦ-25 салатовая (ГОСТ 5406-84) в Краснодаре,210
Эмаль ХВ-113 голубая (ГОСТ 18374-79) в Краснодаре,215
Краска МА-22 салатовая (ГОСТ 10503-71) в Краснодаре,145
Эмаль ХВ-110 коричневая (ГОСТ 18374-79) в Краснодаре,215
Эмаль ПФ-188 красно-коричневая (ГОСТ 24784-81) в Краснодаре,190
Эмаль НЦ-25 серая (ГОСТ 5406-84) в Краснодаре,210
Эмаль НЦ-25 защитная (ГОСТ 5406-84) в Краснодаре,210
Эмаль МЛ-1100 светло-дымчатая (ТУ 20.30.22-002-83706890-2008) в Краснодаре,240
Эмаль АУ-1518Р синяя (ТУ 20.30.22-002-83706890-2008) в Краснодаре,280
Эмаль ХС-436 синяя (ТУ 20.30.22-002-83706890-2008) в Краснодаре,320
Эмаль ЭП-525 синяя (ГОСТ 22438-85) в Краснодаре,235
Эмаль АС-182 защитная (ГОСТ 19024-79) в Краснодаре,220
Эмаль ЭП-51 красная (ГОСТ 9640-85) в Краснодаре,320
Эмаль ХС-759 зелёная (ГОСТ 23494-79) в Краснодаре,260
Эмаль КО-811 зелёная (ГОСТ 23122-78) в Краснодаре,225
Эмаль АС-182 зелёная (ГОСТ 19024-79) в Краснодаре,220
Эмаль ХВ-161 салатная (ТУ 301-10-908-92) в Краснодаре,200
Эмаль ЭП-5287 зелёная (ТУ 6-21-87-97) в Краснодаре,310
Эмаль ХВ-16 бежевая (ТУ 6-10-1301-83) в Краснодаре,200
Эмаль ПФ-188 зелёная (ГОСТ 24784-81) в Краснодаре,190
Эмаль ХВ-161 коричневая (ТУ 301-10-908-92) в Краснодаре,200
Эмаль ХВ-16 светло-серая (ТУ 6-10-1301-83) в Краснодаре,200
Эмаль ХВ-16 защитная (ТУ 6-10-1301-83) в Краснодаре,200
Краска МА-25 зелёная (ГОСТ 10503-71) в Краснодаре,145
Эмаль ХВ-161 защитная (ТУ 301-10-908-92) в Краснодаре,200
Краска МА-22 зелёная (ГОСТ 10503-71) в Краснодаре,145
Эмаль ХВ-16 коричневая (ТУ 6-10-1301-83) в Краснодаре,200
Грунт-эмаль ПФ-100 зелёная (ГОСТ Р 51691-2000) в Краснодаре,210
Краска МА-15 зелёная (ГОСТ 10503-71) в Краснодаре,145
Эмаль ХВ-161 бежевая (ТУ 301-10-908-92) в Краснодаре,200
Эмаль ХВ-113 зелёная (ГОСТ 18374-79) в Краснодаре,215
Эмаль ЭП-1236 зеленая (ГОСТ 23143-83) в Краснодаре,235
Эмаль ХВ-110 зелёная (ГОСТ 18374-79) в Краснодаре,215
Эмаль ХВ-1110 зелёная (ГОСТ 6993-79) в Краснодаре,210
Эмаль ХВ-1100 зелёная (ГОСТ 6993-79) в Краснодаре,210
Эмаль ХС-710 зелёная (ГОСТ 9355-81) в Краснодаре,235
Эмаль ЭП-525 зелёная (ГОСТ 22438-85) в Краснодаре,235
Эмаль ЭП-1294 зелёная (ТУ 6-21-69-92) в Краснодаре,285
Эмаль ХВ-1120 зелёная (ТУ 6-10-1227-77) в Краснодаре,210
Эмаль ЭП-140 серебристая (ГОСТ 24709-81) в Краснодаре,210
Эмаль ЭП-773 зеленая (ГОСТ 23143-83) в Краснодаре,235
Эмаль ЭП-140 зелёная (ГОСТ 24709-81) в Краснодаре,210
Эмаль ЭП-5285 зелёная (ТУ 95-2184-90) в Краснодаре,315
Эмаль КО-8101 зелёная (ТУ 6-10-959-75) в Краснодаре,370
Эмаль ХС-759 красно-коричневая (ГОСТ 23494-79) в Краснодаре,260
Эмаль КО-8101 синяя (ТУ 6-10-959-75) в Краснодаре,370
Эмаль ЭП-1236 красная (ГОСТ 23143-83) в Краснодаре,235
Краска МА-15 чёрная (ГОСТ 10503-71) в Краснодаре,145
Эмаль ЭП-5285 белая (ТУ 95-2184-90) в Краснодаре,315
Грунт-эмаль ПФ-100 чёрная (ГОСТ Р 51691-2000) в Краснодаре,210
Эмаль ХВ-110 белая (ГОСТ 18374-79) в Краснодаре,215
Эмаль КО-8101 салатная (ТУ 6-10-959-75) в Краснодаре,370
Эмаль ЭП-1294 синяя (ТУ 6-21-69-92) в Краснодаре,285
Эмаль НЦ-11 голубая (ГОСТ 9198-83) в Краснодаре,230
Эмаль НЦ-11 серая (ГОСТ 9198-83) в Краснодаре,230
Эмаль КО-8101 голубая (ТУ 6-10-959-75) в Краснодаре,370
Эмаль НЦ-11 фисташковая (ГОСТ 9198-83) в Краснодаре,230
Краска МА-15 жёлтая (ГОСТ 10503-71) в Краснодаре,145
Эмаль АУ-167 голубая (ТУ 2310-005-84928782-2012) в Краснодаре,195
Краска МА-22 красно-коричневая (ГОСТ 10503-71) в Краснодаре,145
Краска МА-25 белая (ГОСТ 10503-71) в Краснодаре,145
Эмаль ЭП-525 жёлтая (ГОСТ 22438-85) в Краснодаре,235
Эмаль КО-8101 красная (ТУ 6-10-959-75) в Краснодаре,370
Эмаль ЭП-525 светло-серая (ГОСТ 22438-85) в Краснодаре,235
Эмаль МЛ-1100 коричневая (ТУ 20.30.22-002-83706890-2008) в Краснодаре,240
Эмаль ПФ-188 светло-серая (ГОСТ 24784-81) в Краснодаре,190
Эмаль ЭП-1294 белая (ТУ 6-21-69-92) в Краснодаре,285
Эмаль КО-811 синяя (ГОСТ 23122-78) в Краснодаре,225
Эмаль НЦ-11 синяя (ГОСТ 9198-83) в Краснодаре,230
Эмаль МЛ-1100 оранжевая (ТУ 20.30.22-002-83706890-2008) в Краснодаре,240
Краска МА-15 салатовая (ГОСТ 10503-71) в Краснодаре,145
Краска МА-25 серая (ГОСТ 10503-71) в Краснодаре,145
Эмаль ПФ-188 белая (ГОСТ 24784-81) в Краснодаре,190
Эмаль ХС-759 чёрная (ГОСТ 23494-79) в Краснодаре,260
Эмаль ЭП-51 жёлтая (ГОСТ 9640-85) в Краснодаре,320
Краска МА-25 голубая (ГОСТ 10503-71) в Краснодаре,145
Эмаль ПФ-188 серая (ГОСТ 24784-81) в Краснодаре,190
Эмаль НЦ-25 жёлтая (ГОСТ 5406-84) в Краснодаре,210
Эмаль ЭП-51 защитная (ГОСТ 9640-85) в Краснодаре,320
Краска МА-22 белая (ГОСТ 10503-71) в Краснодаре,145
Эмаль ХС-759 жёлтая (ГОСТ 23494-79) в Краснодаре,260
Грунт-эмаль ПФ-100 коричневая (ГОСТ Р 51691-2000) в Краснодаре,210
Эмаль ЭП-1236 светло-серая (ГОСТ 23143-83) в Краснодаре,235
Эмаль ЭП-5285 оранжевая (ТУ 95-2184-90) в Краснодаре,315
Эмаль ХС-759 оранжевая (ГОСТ 23494-79) в Краснодаре,260
Эмаль ХС-717 с алюминиевой пудрой (ТУ 6-27-102-99) в Краснодаре,320
Эмаль АС-182 жёлтая (ГОСТ 19024-79) в Краснодаре,220
Эмаль ЭП-51 голубая (ГОСТ 9640-85) в Краснодаре,320
Эмаль ПФ-188 голубая (ГОСТ 24784-81) в Краснодаре,190
Эмаль ПФ-188 оранжевая (ГОСТ 24784-81) в Краснодаре,190
Эмаль ХС-759 голубая (ГОСТ 23494-79) в Краснодаре,260
Краска МА-15 бежевая (ГОСТ 10503-71) в Краснодаре,145
Краска МА-22 синяя (ГОСТ 10503-71) в Краснодаре,145
Эмаль ПФ-266 жёлто-коричневая (ГОСТ Р 51691-2008) в Краснодаре,150
Эмаль НЦ-25 белая (ГОСТ 5406-84) в Краснодаре,210
Эмаль ХВ-110 красно-коричневая (ГОСТ 18374-79) в Краснодаре,215
Эмаль КО-811 чёрная (ГОСТ 23122-78) в Краснодаре,225
Грунт-эмаль ПФ-100 белая (ГОСТ Р 51691-2000) в Краснодаре,210
Эмаль ЭП-1294 серая (ТУ 6-21-69-92) в Краснодаре,285
Краска МА-15 красная (ГОСТ 10503-71) в Краснодаре,145
Эмаль ХВ-110 оранжевая (ГОСТ 18374-79) в Краснодаре,215
Эмаль ХВ-1110 синяя (ГОСТ 6993-79) в Краснодаре,210
Эмаль КО-811 бежевая (ГОСТ 23122-78) в Краснодаре,225
Эмаль МЛ-1100 белая (ТУ 20.30.22-002-83706890-2008) в Краснодаре,240
Краска МА-15 красно-коричневая (ГОСТ 10503-71) в Краснодаре,145
Эмаль ХС-710 красно-коричневая (ГОСТ 9355-81) в Краснодаре,235
Эмаль ЭП-5287 салатная (ТУ 6-21-87-97) в Краснодаре,310
Эмаль ЭП-5287 оранжевая (ТУ 6-21-87-97) в Краснодаре,310
Эмаль ЭП-5285 жёлтая (ТУ 95-2184-90) в Краснодаре,315
Эмаль ПФ-133 защитная (ГОСТ 926-82) в Краснодаре,175
Эмаль АС-182 чёрная (ГОСТ 19024-79) в Краснодаре,220
Эмаль ХС-710 салатная (ГОСТ 9355-81) в Краснодаре,235
Эмаль ХС-710 белая (ГОСТ 9355-81) в Краснодаре,235
Краска МА-25 красная (ГОСТ 10503-71) в Краснодаре,145
Эмаль ПФ-188 красная (ГОСТ 24784-81) в Краснодаре,190
Эмаль ЭП-1236 белая (ГОСТ 23143-83) в Краснодаре,235
Эмаль АУ-167 красная (ТУ 2310-005-84928782-2012) в Краснодаре,195
Эмаль ЭП-1236 красно-коричневая (ГОСТ 23143-83) в Краснодаре,235
Эмаль ЭП-51 салатовая (ГОСТ 9640-85) в Краснодаре,320
Грунт-эмаль ПФ-100 синяя (ГОСТ Р 51691-2000) в Краснодаре,210
Эмаль ХВ-110 красная (ГОСТ 18374-79) в Краснодаре,215
Эмаль ЭП-525 голубая (ГОСТ 22438-85) в Краснодаре,235
Эмаль ХВ-113 синяя (ГОСТ 18374-79) в Краснодаре,215
Эмаль ЭП-1294 жёлтая (ТУ 6-21-69-92) в Краснодаре,285
Грунт-эмаль ПФ-100 салатовая (ГОСТ Р 51691-2000) в Краснодаре,210
Эмаль ЭП-51 коричневая (ГОСТ 9640-85) в Краснодаре,320
Эмаль НЦ-25 красная (ГОСТ 5406-84) в Краснодаре,210
Эмаль МЛ-1100 желтая (ТУ 20.30.22-002-83706890-2008) в Краснодаре,240
Эмаль ХС-759 коричневая (ГОСТ 23494-79) в Краснодаре,260
Эмаль КО-8101 жёлтая (ТУ 6-10-959-75) в Краснодаре,370
Эмаль ЭП-1236 оранжевая (ГОСТ 23143-83) в Краснодаре,235
Эмаль АС-182 коричневая (ГОСТ 19024-79) в Краснодаре,220
Эмаль КО-8101 чёрная (ТУ 6-10-959-75) в Краснодаре,370
Грунт-эмаль ПФ-100 голубая (ГОСТ Р 51691-2000) в Краснодаре,210
Эмаль ХС-436 красная (ТУ 20.30.22-002-83706890-2008) в Краснодаре,320
Краска МА-22 красная (ГОСТ 10503-71) в Краснодаре,145
Эмаль ЭП-525 серая (ГОСТ 22438-85) в Краснодаре,235
Грунт-эмаль ПФ-100 жёлтая (ГОСТ Р 51691-2000) в Краснодаре,210
Эмаль АС-182 синяя (ГОСТ 19024-79) в Краснодаре,220
Эмаль КО-8101 коричневая (ТУ 6-10-959-75) в Краснодаре,370
Эмаль АУ-1518Р белая (ТУ 20.30.22-002-83706890-2008) в Краснодаре,280
Эмаль ХС-710 голубая (ГОСТ 9355-81) в Краснодаре,235
Эмаль ХС-436 голубая (ТУ 20.30.22-002-83706890-2008) в Краснодаре,320
Эмаль ЭП-1294 красная (ТУ 6-21-69-92) в Краснодаре,285
Эмаль МЛ-165 серая (ГОСТ 12034-77) в Краснодаре,305
Грунт-эмаль ПФ-100 серая (ГОСТ Р 51691-2000) в Краснодаре,210
Эмаль ЭП-1236 серая (ГОСТ 23143-83) в Краснодаре,235
Эмаль НЦ-11 защитная (ГОСТ 9198-83) в Краснодаре,230
Эмаль ХС-710 синяя (ГОСТ 9355-81) в Краснодаре,235
Эмаль ЭП-1294 бежевая (ТУ 6-21-69-92) в Краснодаре,285
Эмаль ХС-436 черная (ТУ 20.30.22-002-83706890-2008) в Краснодаре,320
Эмаль МЛ-1100 светло-голубая (ТУ 20.30.22-002-83706890-2008) в Краснодаре,240
Эмаль ХВ-110 бежевая (ГОСТ 18374-79) в Краснодаре,215
Эмаль КО-8101 светло-серая (ТУ 6-10-959-75) в Краснодаре,370
Эмаль ЭП-773 голубая (ГОСТ 23143-83) в Краснодаре,235
Эмаль КО-8101 бежевая (ТУ 6-10-959-75) в Краснодаре,370
Эмаль ХВ-1110 светло-серая (ГОСТ 6993-79) в Краснодаре,210
Эмаль ЭП-525 коричневая (ГОСТ 22438-85) в Краснодаре,235
Эмаль ЭП-51 фисташковая (ГОСТ 9640-85) в Краснодаре,320
Краска МА-15 светло-серая (ГОСТ 10503-71) в Краснодаре,145
Эмаль ГФ-92 ХС серая (ГОСТ 9151-75) в Краснодаре,210
Эмаль ХВ-1100 салатная (ГОСТ 6993-79) в Краснодаре,210
Эмаль ЭП-1294 салатная (ТУ 6-21-69-92) в Краснодаре,285
Эмаль АС-182 салатная (ГОСТ 19024-79) в Краснодаре,220
Эмаль ХВ-1110 белая (ГОСТ 6993-79) в Краснодаре,210
Эмаль КО-8101 оранжевая (ТУ 6-10-959-75) в Краснодаре,370
Эмаль НЦ-25 красно-коричневая (ГОСТ 5406-84) в Краснодаре,210
Эмаль ЭП-5285 серая (ТУ 95-2184-90) в Краснодаре,315
Эмаль ЭП-5285 салатная (ТУ 95-2184-90) в Краснодаре,315
Эмаль ХС-436 серая (ТУ 20.30.22-002-83706890-2008) в Краснодаре,320
Эмаль АУ-1518Р голубая (ТУ 20.30.22-002-83706890-2008) в Краснодаре,280
Эмаль АУ-1518Р защитная (ТУ 20.30.22-002-83706890-2008) в Краснодаре,280
Эмаль ХВ-113 бежевая (ГОСТ 18374-79) в Краснодаре,215
Эмаль ЭП-5287 серая (ТУ 6-21-87-97) в Краснодаре,310
Эмаль ЭП-525 красная (ГОСТ 22438-85) в Краснодаре,235
Эмаль ХВ-1100 оранжевая (ГОСТ 6993-79) в Краснодаре,210
Эмаль МЛ-1100 голубая (ТУ 20.30.22-002-83706890-2008) в Краснодаре,240
Эмаль ПФ-133 чёрная (ГОСТ 926-82) в Краснодаре,175
Эмаль ЭП-1294 оранжевая (ТУ 6-21-69-92) в Краснодаре,285
Эмаль ЭП-5285 светло-серая (ТУ 95-2184-90) в Краснодаре,315
Эмаль ЭП-5285 коричневая (ТУ 95-2184-90) в Краснодаре,315
Эмаль НЦ-25 зелёная (ГОСТ 5406-84) в Краснодаре,210
Эмаль КО-811 красно-коричневая (ГОСТ 23122-78) в Краснодаре,225
Эмаль НЦ-25 чёрная (ГОСТ 5406-84) в Краснодаре,210
Эмаль ЭП-51 красно-коричневая (ГОСТ 9640-85) в Краснодаре,320
Эмаль ЭП-5287 красная (ТУ 6-21-87-97) в Краснодаре,310
Эмаль ПФ-188 синяя (ГОСТ 24784-81) в Краснодаре,190
Эмаль ХС-436 белая (ТУ 20.30.22-002-83706890-2008) в Краснодаре,320
Эмаль НЦ-11 белая (ГОСТ 9198-83) в Краснодаре,230
Эмаль ХС-436 фисташковая (ТУ 20.30.22-002-83706890-2008) в Краснодаре,320
Эмаль ЭП-51 светло-серая (ГОСТ 9640-85) в Краснодаре,320
Эмаль МЛ-1100 красная (ТУ 20.30.22-002-83706890-2008) в Краснодаре,240
Эмаль АУ-1518Р чёрная (ТУ 20.30.22-002-83706890-2008) в Краснодаре,280
Эмаль ХВ-1100 синяя (ГОСТ 6993-79) в Краснодаре,210
Эмаль НЦ-11 светло-серая (ГОСТ 9198-83) в Краснодаре,230
Эмаль АС-182 бежевая (ГОСТ 19024-79) в Краснодаре,220
Краска МА-25 салатовая (ГОСТ 10503-71) в Краснодаре,145
Эмаль ЭП-1294 голубая (ТУ 6-21-69-92) в Краснодаре,285
Краска МА-25 жёлтая (ГОСТ 10503-71) в Краснодаре,145
Эмаль ХВ-1110 защитная (ГОСТ 6993-79) в Краснодаре,210
Эмаль НЦ-25 светло-серая (ГОСТ 5406-84) в Краснодаре,210
Эмаль ХВ-1100 бежевая (ГОСТ 6993-79) в Краснодаре,210
Эмаль ПФ-188 салатовая (ГОСТ 24784-81) в Краснодаре,190
Эмаль ЭП-5287 голубая (ТУ 6-21-87-97) в Краснодаре,310
Грунт-эмаль ПФ-100 защитная (ГОСТ Р 51691-2000) в Краснодаре,210
Эмаль ХВ-1100 жёлтая (ГОСТ 6993-79) в Краснодаре,210
Эмаль ЭП-773 белая (ГОСТ 23143-83) в Краснодаре,235
Эмаль ЭП-1236 черная (ГОСТ 23143-83) в Краснодаре,235
Эмаль ХС-710 жёлтая (ГОСТ 9355-81) в Краснодаре,235
Эмаль ХВ-113 светло-серая (ГОСТ 18374-79) в Краснодаре,215
Эмаль ЭП-773 синяя (ГОСТ 23143-83) в Краснодаре,235
Эмаль ЭП-5285 защитная (ТУ 95-2184-90) в Краснодаре,315
Эмаль НЦ-11 жёлтая (ГОСТ 9198-83) в Краснодаре,230
Эмаль ЭП-5285 красно-коричневая (ТУ 95-2184-90) в Краснодаре,315
Эмаль КО-811 светло-серая (ГОСТ 23122-78) в Краснодаре,225
Эмаль ЭП-773 серая (ГОСТ 23143-83) в Краснодаре,235
Эмаль ХС-436 красно-коричневая (ТУ 20.30.22-002-83706890-2008) в Краснодаре,320
Эмаль ЭП-5285 красная (ТУ 95-2184-90) в Краснодаре,315
Эмаль МЛ-1100 синяя (ТУ 20.30.22-002-83706890-2008) в Краснодаре,240
Эмаль НЦ-11 коричневая (ГОСТ 9198-83) в Краснодаре,230
Эмаль ЭП-773 красная (ГОСТ 23143-83) в Краснодаре,235
Эмаль МЛ-1100 золотисто-желтая (ТУ 20.30.22-002-83706890-2008) в Краснодаре,240
Эмаль ХС-436 бежевая (ТУ 20.30.22-002-83706890-2008) в Краснодаре,320
Эмаль МЛ-1100 песочная (ТУ 20.30.22-002-83706890-2008) в Краснодаре,240
Эмаль АС-5307 желтая (СТП 6-3-121-2001) в Краснодаре,220
Эмаль ХВ-1110 голубая (ГОСТ 6993-79) в Краснодаре,210
Эмаль НЦ-11 салатовая (ГОСТ 9198-83) в Краснодаре,230
Эмаль ЭП-5285 чёрная (ТУ 95-2184-90) в Краснодаре,315
Эмаль ПФ-266 красно-коричневая (ГОСТ Р 51691-2008) в Краснодаре,150
Эмаль ЭП-5285 бежевая (ТУ 95-2184-90) в Краснодаре,315
Краска МА-15 защитная (ГОСТ 10503-71) в Краснодаре,145
Краска МА-25 красно-коричневая (ГОСТ 10503-71) в Краснодаре,145
Эмаль ЭП-1236 синяя (ГОСТ 23143-83) в Краснодаре,235
Эмаль КО-8101 красно-коричневая (ТУ 6-10-959-75) в Краснодаре,370
Эмаль АУ-1518Р коричневая (ТУ 20.30.22-002-83706890-2008) в Краснодаре,280
Краска МА-25 коричневая (ГОСТ 10503-71) в Краснодаре,145
Эмаль ХВ-1110 жёлтая (ГОСТ 6993-79) в Краснодаре,210
Эмаль ХС-710 красная (ГОСТ 9355-81) в Краснодаре,235
Эмаль ПФ-188 жёлтая (ГОСТ 24784-81) в Краснодаре,190
Эмаль ХВ-113 красная (ГОСТ 18374-79) в Краснодаре,215
Эмаль ЭП-525 белая (ГОСТ 22438-85) в Краснодаре,235
Эмаль АУ-167 белая (ТУ 2310-005-84928782-2012) в Краснодаре,195
Эмаль АУ-167 защитная (ТУ 2310-005-84928782-2012) в Краснодаре,195
Эмаль КО-811 защитная (ГОСТ 23122-78) в Краснодаре,225
Эмаль ХС-436 жёлтая (ТУ 20.30.22-002-83706890-2008) в Краснодаре,320
Грунт-эмаль ПФ-100 оранжевая (ГОСТ Р 51691-2000) в Краснодаре,210
Эмаль АС-182 оранжевая (ГОСТ 19024-79) в Краснодаре,220
Краска МА-22 голубая (ГОСТ 10503-71) в Краснодаре,145
Эмаль ЭП-5285 синяя (ТУ 95-2184-90) в Краснодаре,315
Эмаль АС-182 голубая (ГОСТ 19024-79) в Краснодаре,220
Эмаль НЦ-11 красная (ГОСТ 9198-83) в Краснодаре,230
Краска МА-25 защитная (ГОСТ 10503-71) в Краснодаре,145
Эмаль ЭП-1236 голубая (ГОСТ 23143-83) в Краснодаре,235
Эмаль АС-182 красно-коричневая (ГОСТ 19024-79) в Краснодаре,220
Эмаль АУ-1518Р красно-коричневая (ТУ 20.30.22-002-83706890-2008) в Краснодаре,280
Эмаль ЭП-5287 коричневая (ТУ 6-21-87-97) в Краснодаре,310
Эмаль ЭП-51 бежевая (ГОСТ 9640-85) в Краснодаре,320
Эмаль АУ-1518Р зелёная (ТУ 20.30.22-002-83706890-2008) в Краснодаре,280
Эмаль ЭП-773 желтая (ГОСТ 23143-83) в Краснодаре,235
Эмаль ХС-436 светло-серая (ТУ 20.30.22-002-83706890-2008) в Краснодаре,320
Эмаль КО-8101 защитная (ТУ 6-10-959-75) в Краснодаре,370
Эмаль НЦ-11 оранжевая (ГОСТ 9198-83) в Краснодаре,230
Эмаль ХС-436 зелёная (ТУ 20.30.22-002-83706890-2008) в Краснодаре,320
Эмаль ЭП-525 черная (ГОСТ 22438-85) в Краснодаре,235
Краска МА-25 синяя (ГОСТ 10503-71) в Краснодаре,145
Эмаль ЭП-5287 жёлтая (ТУ 6-21-87-97) в Краснодаре,310
Эмаль ЭП-1236 жёлтая (ГОСТ 23143-83) в Краснодаре,235
Эмаль ЭП-5287 синяя (ТУ 6-21-87-97) в Краснодаре,310
Эмаль ПФ-133 зелёная (ГОСТ 926-82) в Краснодаре,175
Эмаль ЭП-140 синяя (ГОСТ 24709-81) в Краснодаре,210
Эмаль ХВ-1110 салатная (ГОСТ 6993-79) в Краснодаре,210
Эмаль НЦ-11 бежевая (ГОСТ 9198-83) в Краснодаре,230
Эмаль ХВ-1100 красно-коричневая (ГОСТ 6993-79) в Краснодаре,210
Краска МА-22 оранжевая (ГОСТ 10503-71) в Краснодаре,145
Эмаль ЭП-140 голубая (ГОСТ 24709-81) в Краснодаре,210
Эмаль АУ-1518Р бежевая (ТУ 20.30.22-002-83706890-2008) в Краснодаре,280
Эмаль ЭП-773 светло-серая (ГОСТ 23143-83) в Краснодаре,235
Эмаль ХВ-1120 красная (ТУ 6-10-1227-77) в Краснодаре,210
Эмаль ХВ-1100 белая (ГОСТ 6993-79) в Краснодаре,210
Эмаль ХС-436 коричневая (ТУ 20.30.22-002-83706890-2008) в Краснодаре,320
Эмаль АС-5307 черная (СТП 6-3-121-2001) в Краснодаре,220
Эмаль КО-811 оранжевая (ГОСТ 23122-78) в Краснодаре,225
Эмаль ХС-759 светло-серая (ГОСТ 23494-79) в Краснодаре,260
Эмаль ПФ-133 оранжевая (ГОСТ 926-82) в Краснодаре,175
Эмаль КО-198 красная (ТУ 6-02-841-74) в Краснодаре,180
Эмаль НЦ-132 защитная (ГОСТ Р 51691-2008) в Краснодаре,215
Эмаль КО-174 оранжевая (ТУ 6-02-576-87) в Краснодаре,180
Эмаль ПФ-133 белая (ГОСТ 926-82) в Краснодаре,175
Краска МА-25 бежевая (ГОСТ 10503-71) в Краснодаре,145
Эмаль ХВ-785 синяя (ГОСТ 7313-75)  в Краснодаре,200
Эмаль НЦ-132 бежевая (ГОСТ Р 51691-2008) в Краснодаре,215
Эмаль МЛ-1110 желтая (ГОСТ 20481-80) в Краснодаре,240
Эмаль КО-174 голубая (ТУ 6-02-576-87) в Краснодаре,180
Эмаль НЦ-132 синяя (ГОСТ Р 51691-2008) в Краснодаре,215
