name,price
Эмаль ХВ-16 красно-коричневая (ТУ 6-10-1301-83) в Краснодаре,200
Эмаль МЛ-1110 коричневая (ГОСТ 20481-80) в Краснодаре,240
Эмаль МЛ-1110 золотисто-желтая (ГОСТ 20481-80) в Краснодаре,240
Эмаль ХВ-124 черная (ГОСТ 10144-89) в Краснодаре,200
Эмаль МЛ-1110 синяя (ГОСТ 20481-80) в Краснодаре,240
Эмаль НЦ-132 фисташковая (ГОСТ Р 51691-2008) в Краснодаре,215
Эмаль ХВ-161 черная (ТУ 301-10-908-92) в Краснодаре,200
Эмаль КО-174 зеленая (ТУ 6-02-576-87) в Краснодаре,180
Эмаль ХВ-161 красная (ТУ 301-10-908-92) в Краснодаре,200
Эмаль МЛ-1110 песочная (ГОСТ 20481-80) в Краснодаре,240
Эмаль КО-174 синяя (ТУ 6-02-576-87) в Краснодаре,180
Эмаль МЛ-1110 серо-голубая (ГОСТ 20481-80) в Краснодаре,240
Эмаль ХВ-161 голубая (ТУ 301-10-908-92) в Краснодаре,200
Эмаль НЦ-132 салатовая (ГОСТ Р 51691-2008) в Краснодаре,215
Эмаль КО-198 оранжевая (ТУ 6-02-841-74) в Краснодаре,180
Эмаль КО-8101 серебристо-серая (ТУ 6-10-959-75) в Краснодаре,370
Эмаль КО-198 голубая (ТУ 6-02-841-74) в Краснодаре,180
Эмаль ХВ-785 голубая (ГОСТ 7313-75)  в Краснодаре,200
Эмаль КО-174 желтая (ТУ 6-02-576-87) в Краснодаре,180
Эмаль ПФ-133 серая (ГОСТ 926-82) в Краснодаре,175
Эмаль МЛ-1110 черная (ГОСТ 20481-80) в Краснодаре,240
Эмаль КО-174 коричневая (ТУ 6-02-576-87) в Краснодаре,180
Эмаль ЭП-140 белая (ГОСТ 24709-81) в Краснодаре,210
Грунт-эмаль ПФ-100 бежевая (ГОСТ Р 51691-2000) в Краснодаре,210
Эмаль НЦ-132 красно-коричневая (ГОСТ Р 51691-2008) в Краснодаре,215
Эмаль МЛ-1110 голубая (ГОСТ 20481-80) в Краснодаре,240
Эмаль АУ-167 оранжевая (ТУ 2310-005-84928782-2012) в Краснодаре,195
Эмаль АУ-167 зелёная (ТУ 2310-005-84928782-2012) в Краснодаре,195
Эмаль МЛ-1110 светло-серая (ГОСТ 20481-80) в Краснодаре,240
Эмаль АС-182 белая (ГОСТ 19024-79) в Краснодаре,220
Эмаль ХВ-785 красно-коричневая (ГОСТ 7313-75)  в Краснодаре,200
Эмаль КО-174 белая (ТУ 6-02-576-87) в Краснодаре,180
Эмаль ХВ-161 красно-коричневая (ТУ 301-10-908-92) в Краснодаре,200
Эмаль МЛ-1110 морская волна (ГОСТ 20481-80) в Краснодаре,240
Эмаль ХВ-161 оранжевая (ТУ 301-10-908-92) в Краснодаре,200
Эмаль НЦ-132 коричневая (ГОСТ Р 51691-2008) в Краснодаре,215
Эмаль ЭП-51 чёрная (ГОСТ 9640-85) в Краснодаре,320
Эмаль ЭП-51 синяя (ГОСТ 9640-85) в Краснодаре,320
Эмаль ПФ-133 красная (ГОСТ 926-82) в Краснодаре,175
Эмаль ХС-759 белая (ГОСТ 23494-79) в Краснодаре,260
Эмаль КО-811 жёлтая (ГОСТ 23122-78) в Краснодаре,225
Эмаль ХС-759 серая (ГОСТ 23494-79) в Краснодаре,260
Эмаль АС-5307 белая (СТП 6-3-121-2001) в Краснодаре,220
Эмаль ХВ-125 серебристо-серая (ГОСТ 10144-89) в Краснодаре,350
Эмаль МЛ-1110 светло-дымчатая (ГОСТ 20481-80) в Краснодаре,240
Эмаль АУ-167 чёрная (ТУ 2310-005-84928782-2012) в Краснодаре,195
Эмаль АУ-167 коричневая (ТУ 2310-005-84928782-2012) в Краснодаре,195
Эмаль НЦ-132 светло-серая (ГОСТ Р 51691-2008) в Краснодаре,215
Эмаль МЛ-1110 светло-голубая (ГОСТ 20481-80) в Краснодаре,240
Эмаль АУ-167 светло-серая (ТУ 2310-005-84928782-2012) в Краснодаре,195
Эмаль КО-811 серая (ГОСТ 23122-78) в Краснодаре,225
Эмаль ПФ-133 бежевая (ГОСТ 926-82) в Краснодаре,175
Эмаль ЭП-51 оранжевая (ГОСТ 9640-85) в Краснодаре,320
Грунт-эмаль ПФ-100 светло-серая (ГОСТ Р 51691-2000) в Краснодаре,210
Эмаль ЭП-51 серая (ГОСТ 9640-85) в Краснодаре,320
Эмаль МЛ-1100 защитная (ТУ 20.30.22-002-83706890-2008) в Краснодаре,240
Краска МА-15 голубая (ГОСТ 10503-71) в Краснодаре,145
Эмаль КО-811 голубая (ГОСТ 23122-78) в Краснодаре,225
Эмаль ХС-436 защитная (ТУ 20.30.22-002-83706890-2008) в Краснодаре,320
Эмаль АУ-167 синяя (ТУ 2310-005-84928782-2012) в Краснодаре,195
Эмаль АУ-167 красно-коричневая (ТУ 2310-005-84928782-2012) в Краснодаре,195
Эмаль ХС-759 синяя (ГОСТ 23494-79) в Краснодаре,260
Эмаль КО-8101 белая (ТУ 6-10-959-75) в Краснодаре,370
Эмаль МЛ-1100 морская волна (ТУ 20.30.22-002-83706890-2008) в Краснодаре,240
Краска МА-15 коричневая (ГОСТ 10503-71) в Краснодаре,145
Краска МА-15 синяя (ГОСТ 10503-71) в Краснодаре,145
Эмаль ПФ-133 синяя (ГОСТ 926-82) в Краснодаре,175
Эмаль ПФ-133 коричневая (ГОСТ 926-82) в Краснодаре,175
Эмаль ХС-759 салатная (ГОСТ 23494-79) в Краснодаре,260
Краска МА-15 серая (ГОСТ 10503-71) в Краснодаре,145
Эмаль ЭП-51 белая (ГОСТ 9640-85) в Краснодаре,320
Эмаль АУ-167 салатовая (ТУ 2310-005-84928782-2012) в Краснодаре,195
Эмаль (Краска) АК-15 в Краснодаре,245
Эмаль ХС-710 серая (ГОСТ 9355-81) в Краснодаре,235
Эмаль КО-811 белая (ГОСТ 23122-78) в Краснодаре,225
Эмаль НЦ-25 синяя (ГОСТ 5406-84) в Краснодаре,210
Эмаль ПФ-133 голубая (ГОСТ 926-82) в Краснодаре,175
Эмаль АУ-167 серая (ТУ 2310-005-84928782-2012) в Краснодаре,195
Эмаль АС-182 серая (ГОСТ 19024-79) в Краснодаре,220
Эмаль ЭП-51 зелёная (ГОСТ 9640-85) в Краснодаре,320
Эмаль ПФ-133 красно-коричневая (ГОСТ 926-82) в Краснодаре,175
Эмаль АС-182 красная (ГОСТ 19024-79) в Краснодаре,220
Эмаль АУ-1518Р фисташковая (ТУ 20.30.22-002-83706890-2008) в Краснодаре,280
Краска МА-25 оранжевая (ГОСТ 10503-71) в Краснодаре,145
Эмаль ЭП-5287 белая (ТУ 6-21-87-97) в Краснодаре,310
Эмаль ПФ-133 светло-серая (ГОСТ 926-82) в Краснодаре,175
Эмаль КО-811 салатная (ГОСТ 23122-78) в Краснодаре,225
Краска МА-25 светло-серая (ГОСТ 10503-71) в Краснодаре,145
Эмаль ХС-759 красная (ГОСТ 23494-79) в Краснодаре,260
Эмаль АС-5307 красная (СТП 6-3-121-2001) в Краснодаре,220
Эмаль ЭП-5285 голубая (ТУ 95-2184-90) в Краснодаре,315
Эмаль ПФ-133 салатовая (ГОСТ 926-82) в Краснодаре,175
Грунт-эмаль ПФ-100 красная (ГОСТ Р 51691-2000) в Краснодаре,210
Эмаль ПФ-133 жёлтая (ГОСТ 926-82) в Краснодаре,175
Грунт-эмаль ПФ-100 красно-коричневая (ГОСТ Р 51691-2000) в Краснодаре,210
Краска МА-15 оранжевая (ГОСТ 10503-71) в Краснодаре,145
Эмаль КО-8101 серая (ТУ 6-10-959-75) в Краснодаре,370
Эмаль АУ-167 жёлтая (ТУ 2310-005-84928782-2012) в Краснодаре,195
Эмаль ПФ-188 защитная (ГОСТ 24784-81) в Краснодаре,190
Краска МА-22 серая (ГОСТ 10503-71) в Краснодаре,145
Эмаль ХВ-113 белая (ГОСТ 18374-79) в Краснодаре,215
Эмаль АУ-167 бежевая (ТУ 2310-005-84928782-2012) в Краснодаре,195
Эмаль ЭП-1236 защитная (ГОСТ 23143-83) в Краснодаре,235
Эмаль МЛ-1100 зеленая (ТУ 20.30.22-002-83706890-2008) в Краснодаре,240
Эмаль НЦ-11 чёрная (ГОСТ 9198-83) в Краснодаре,230
Эмаль ЭП-5287 красно-коричневая (ТУ 6-21-87-97) в Краснодаре,310
Эмаль МЛ-1100 черная (ТУ 20.30.22-002-83706890-2008) в Краснодаре,240
Эмаль ГФ-92 ХС красно-коричневая (ГОСТ 9151-75) в Краснодаре,210
Краска МА-22 чёрная (ГОСТ 10503-71) в Краснодаре,145
Эмаль АУ-1518Р жёлтая (ТУ 20.30.22-002-83706890-2008) в Краснодаре,280
Эмаль НЦ-25 бежевая (ГОСТ 5406-84) в Краснодаре,210
Эмаль НЦ-25 голубая (ГОСТ 5406-84) в Краснодаре,210
Эмаль ЭП-773 коричневая (ГОСТ 23143-83) в Краснодаре,235
Эмаль АУ-1518Р красная (ТУ 20.30.22-002-83706890-2008) в Краснодаре,280
Эмаль ЭП-1236 салатная (ГОСТ 23143-83) в Краснодаре,235
Эмаль ЭП-1236 коричневая (ГОСТ 23143-83) в Краснодаре,235
Эмаль АС-182 светло-серая (ГОСТ 19024-79) в Краснодаре,220
Эмаль ХС-436 салатовая (ТУ 20.30.22-002-83706890-2008) в Краснодаре,320
Краска МА-22 жёлтая (ГОСТ 10503-71) в Краснодаре,145
Эмаль ЭП-140 желтая (ГОСТ 24709-81) в Краснодаре,210
Эмаль ХС-710 коричневая (ГОСТ 9355-81) в Краснодаре,235
Эмаль ЭП-5287 защитная (ТУ 6-21-87-97) в Краснодаре,310
Эмаль ЭП-1236 бежевая (ГОСТ 23143-83) в Краснодаре,235
Эмаль МЛ-165 серебристая (ГОСТ 12034-77) в Краснодаре,395
Эмаль ХВ-1120 защитная (ТУ 6-10-1227-77) в Краснодаре,210
Эмаль Полиуретановая белая (ТУ 20.30.22-002-83706890-2008) в Краснодаре,470
Эмаль ХС-710 серебристо-серая (ГОСТ 9355-81) в Краснодаре,235
Эмаль ЭП-773 салатная (ГОСТ 23143-83) в Краснодаре,235
Эмаль ЭП-1294 коричневая (ТУ 6-21-69-92) в Краснодаре,285
Эмаль ХВ-113 жёлтая (ГОСТ 18374-79) в Краснодаре,215
Эмаль КО-811 коричневая (ГОСТ 23122-78) в Краснодаре,225
Эмаль Полиуретановая синяя (ТУ 20.30.22-002-83706890-2008) в Краснодаре,470
Эмаль ЭП-525 бежевая (ГОСТ 22438-85) в Краснодаре,235
Эмаль ХВ-110 голубая (ГОСТ 18374-79) в Краснодаре,215
Эмаль ХС-710 светло-серая (ГОСТ 9355-81) в Краснодаре,235
Эмаль ЭП-1294 защитная (ТУ 6-21-69-92) в Краснодаре,285
Эмаль ЭП-525 оранжевая (ГОСТ 22438-85) в Краснодаре,235
Эмаль ЭП-1294 красно-коричневая (ТУ 6-21-69-92) в Краснодаре,285
Эмаль ХВ-113 оранжевая (ГОСТ 18374-79) в Краснодаре,215
Эмаль ХС-710 чёрная (ГОСТ 9355-81) в Краснодаре,235
Эмаль ХС-436 оранжевая (ТУ 20.30.22-002-83706890-2008) в Краснодаре,320
Эмаль ПФ-188 бежевая (ГОСТ 24784-81) в Краснодаре,190
Краска МА-22 светло-серая (ГОСТ 10503-71) в Краснодаре,145
Эмаль ЭП-525 красно-коричневая (ГОСТ 22438-85) в Краснодаре,235
Эмаль ХС-710 защитная (ГОСТ 9355-81) в Краснодаре,235
Эмаль ХВ-1100 голубая (ГОСТ 6993-79) в Краснодаре,210
Эмаль ХВ-1120 серая (ТУ 6-10-1227-77) в Краснодаре,210
Эмаль ЭП-773 черная (ГОСТ 23143-83) в Краснодаре,235
Эмаль НЦ-25 фисташковая (ГОСТ 5406-84) в Краснодаре,210
Эмаль ЭП-773 красно-коричневая (ГОСТ 23143-83) в Краснодаре,235
Эмаль АУ-1518Р оранжевая (ТУ 20.30.22-002-83706890-2008) в Краснодаре,280
Эмаль АУ-1518Р серая (ТУ 20.30.22-002-83706890-2008) в Краснодаре,280
Эмаль ПФ-188 чёрная (ГОСТ 24784-81) в Краснодаре,190
Эмаль ХС-759 защитная (ГОСТ 23494-79) в Краснодаре,260
Эмаль ЭП-5287 бежевая (ТУ 6-21-87-97) в Краснодаре,310
Краска МА-22 защитная (ГОСТ 10503-71) в Краснодаре,145
Эмаль ХС-759 бежевая (ГОСТ 23494-79) в Краснодаре,260
Эмаль Полиуретановая красно-коричневая (ТУ 20.30.22-002-83706890-2008) в Краснодаре,470
Эмаль ХВ-113 коричневая (ГОСТ 18374-79) в Краснодаре,215
Эмаль ЭП-525 защитная (ГОСТ 22438-85) в Краснодаре,235
Эмаль ХВ-1100 серая (ГОСТ 6993-79) в Краснодаре,210
Эмаль ХВ-1120 оранжевая (ТУ 6-10-1227-77) в Краснодаре,210
Эмаль НЦ-11 зелёная (ГОСТ 9198-83) в Краснодаре,230
Эмаль Полиуретановая серая (ТУ 20.30.22-002-83706890-2008) в Краснодаре,470
Эмаль ХВ-110 жёлтая (ГОСТ 18374-79) в Краснодаре,215
Эмаль ХС-710 оранжевая (ГОСТ 9355-81) в Краснодаре,235
Эмаль МЛ-1100 светло-серая (ТУ 20.30.22-002-83706890-2008) в Краснодаре,240
Эмаль ХВ-110 серая (ГОСТ 18374-79) в Краснодаре,215
Эмаль ХВ-110 чёрная (ГОСТ 18374-79) в Краснодаре,215
Эмаль ПФ-266 золотисто-коричневая (ГОСТ Р 51691-2008) в Краснодаре,150
Эмаль ХС-710 бежевая (ГОСТ 9355-81) в Краснодаре,235
Эмаль Полиуретановая оранжевая (ТУ 20.30.22-002-83706890-2008) в Краснодаре,470
Эмаль ЭП-140 светло-серая (ГОСТ 24709-81) в Краснодаре,210
Эмаль АУ-1518Р светло-серая (ТУ 20.30.22-002-83706890-2008) в Краснодаре,280
Эмаль ПФ-188 коричневая (ГОСТ 24784-81) в Краснодаре,190
Эмаль ХВ-1100 коричневая (ГОСТ 6993-79) в Краснодаре,210
Эмаль ЭП-1294 светло-серая (ТУ 6-21-69-92) в Краснодаре,285
Эмаль Полиуретановая коричневая (ТУ 20.30.22-002-83706890-2008) в Краснодаре,470
Эмаль ХВ-1120 голубая (ТУ 6-10-1227-77) в Краснодаре,210
Эмаль Полиуретановая салатовая (ТУ 20.30.22-002-83706890-2008) в Краснодаре,470
Эмаль ЭП-140 серая (ГОСТ 24709-81) в Краснодаре,210
Эмаль ХВ-1110 серая (ГОСТ 6993-79) в Краснодаре,210
Эмаль ЭП-525 салатная (ГОСТ 22438-85) в Краснодаре,235
Эмаль ХВ-1100 красная (ГОСТ 6993-79) в Краснодаре,210
Эмаль НЦ-25 оранжевая (ГОСТ 5406-84) в Краснодаре,210
Эмаль Полиуретановая фисташковая (ТУ 20.30.22-002-83706890-2008) в Краснодаре,470
Эмаль ХВ-1110 чёрная (ГОСТ 6993-79) в Краснодаре,210
Эмаль ХВ-1120 жёлтая (ТУ 6-10-1227-77) в Краснодаре,210
Эмаль Полиуретановая жёлтая (ТУ 20.30.22-002-83706890-2008) в Краснодаре,470
Эмаль Полиуретановая зелёная (ТУ 20.30.22-002-83706890-2008) в Краснодаре,470
Краска МА-22 коричневая (ГОСТ 10503-71) в Краснодаре,145
Эмаль ЭП-140 коричневая (ГОСТ 24709-81) в Краснодаре,210
Эмаль АУ-1518Р салатовая (ТУ 20.30.22-002-83706890-2008) в Краснодаре,280
Эмаль ЭП-5287 светло-серая (ТУ 6-21-87-97) в Краснодаре,310
Эмаль ХВ-110 салатная (ГОСТ 18374-79) в Краснодаре,215
Эмаль ХВ-113 красно-коричневая (ГОСТ 18374-79) в Краснодаре,215
Эмаль Полиуретановая голубая (ТУ 20.30.22-002-83706890-2008) в Краснодаре,470
Эмаль ЭП-140 салатная (ГОСТ 24709-81) в Краснодаре,210
Эмаль НЦ-25 коричневая (ГОСТ 5406-84) в Краснодаре,210
Эмаль НЦ-11 красно-коричневая (ГОСТ 9198-83) в Краснодаре,230
Эмаль ЭП-1294 чёрная (ТУ 6-21-69-92) в Краснодаре,285
Эмаль ХВ-113 серая (ГОСТ 18374-79) в Краснодаре,215
Эмаль ЭП-140 черная (ГОСТ 24709-81) в Краснодаре,210
Эмаль ХВ-1120 синяя (ТУ 6-10-1227-77) в Краснодаре,210
Эмаль Полиуретановая светло-серая (ТУ 20.30.22-002-83706890-2008) в Краснодаре,470
Эмаль ХВ-1120 коричневая (ТУ 6-10-1227-77) в Краснодаре,210
Эмаль ХВ-110 защитная (ГОСТ 18374-79) в Краснодаре,215
Эмаль ХВ-1110 бежевая (ГОСТ 6993-79) в Краснодаре,210
Эмаль ЭП-773 оранжевая (ГОСТ 23143-83) в Краснодаре,235
Эмаль ЭП-140 красная (ГОСТ 24709-81) в Краснодаре,210
Эмаль ХВ-1100 светло-серая (ГОСТ 6993-79) в Краснодаре,210
Эмаль ХВ-1110 красная (ГОСТ 6993-79) в Краснодаре,210
Эмаль ХВ-110 светло-серая (ГОСТ 18374-79) в Краснодаре,215
Эмаль ХВ-1100 защитная (ГОСТ 6993-79) в Краснодаре,210
Эмаль ЭП-140 защитная (ГОСТ 24709-81) в Краснодаре,210
Эмаль ХВ-1110 оранжевая (ГОСТ 6993-79) в Краснодаре,210
Эмаль ЭП-140 бежевая (ГОСТ 24709-81) в Краснодаре,210
Краска МА-22 бежевая (ГОСТ 10503-71) в Краснодаре,145
Эмаль ЭП-140 оранжевая (ГОСТ 24709-81) в Краснодаре,210
Эмаль ХВ-1120 бежевая (ТУ 6-10-1227-77) в Краснодаре,210
Эмаль ХВ-110 синяя (ГОСТ 18374-79) в Краснодаре,215
Эмаль Полиуретановая чёрная (ТУ 20.30.22-002-83706890-2008) в Краснодаре,470
Эмаль Полиуретановая защитная (ТУ 20.30.22-002-83706890-2008) в Краснодаре,470
Эмаль ЭП-140 красно-коричневая (ГОСТ 24709-81) в Краснодаре,210
Эмаль ХВ-1120 красно-коричневая (ТУ 6-10-1227-77) в Краснодаре,210
Эмаль Полиуретановая красная (ТУ 20.30.22-002-83706890-2008) в Краснодаре,470
Эмаль ХВ-1120 светло-серая (ТУ 6-10-1227-77) в Краснодаре,210
Эмаль ХВ-113 салатовая (ГОСТ 18374-79) в Краснодаре,215
Эмаль ХВ-113 чёрная (ГОСТ 18374-79) в Краснодаре,215
Эмаль ХВ-1100 чёрная (ГОСТ 6993-79) в Краснодаре,210
Эмаль ХВ-1120 чёрная (ТУ 6-10-1227-77) в Краснодаре,210
Эмаль ХВ-124 бежевая (ГОСТ 10144-89) в Краснодаре,200
Эмаль ХВ-16 салатовая (ТУ 6-10-1301-83) в Краснодаре,200
Эмаль КО-198 бежевая (ТУ 6-02-841-74) в Краснодаре,180
Эмаль КО-198 красно-коричневая (ТУ 6-02-841-74) в Краснодаре,180
Эмаль КО-198 салатовая (ТУ 6-02-841-74) в Краснодаре,180
Эмаль КО-198 светло-серая (ТУ 6-02-841-74) в Краснодаре,180
Эмаль Полиуретановая бежевая (ТУ 20.30.22-002-83706890-2008) в Краснодаре,470
Эмаль ХВ-1120 салатовая (ТУ 6-10-1227-77) в Краснодаре,210
Эмаль КО-198 белая (ТУ 6-02-841-74) в Краснодаре,180
Эмаль КО-811 красная (ГОСТ 23122-78) в Краснодаре,225
Эмаль ЭП-773 бежевая (ГОСТ 23143-83) в Краснодаре,235
Эмаль ХВ-113 защитная (ГОСТ 18374-79) в Краснодаре,215
Эмаль ХВ-1110 коричневая (ГОСТ 6993-79) в Краснодаре,210
Эмаль ХВ-1110 красно-коричневая (ГОСТ 6993-79) в Краснодаре,210
Эмаль ЭП-773 защитная (ГОСТ 23143-83) в Краснодаре,235
Эмаль НЦ-132 красная (ГОСТ Р 51691-2008) в Краснодаре,215
Эмаль ХВ-16 синяя (ТУ 6-10-1301-83) в Краснодаре,200
Эмаль НЦ-132 желтая (ГОСТ Р 51691-2008) в Краснодаре,215
Эмаль АК-511 красная (ГОСТ Р 52575-2006) в Краснодаре,170
Эмаль АК-511 оранжевая (ГОСТ Р 52575-2006) в Краснодаре,170
Эмаль МЛ-12 оранжевая (ГОСТ 9754-76) в Краснодаре,240
Эмаль МЛ-12 золотисто-желтая (ГОСТ 9754-76) в Краснодаре,240
Эмаль НЦ-1125 (ГОСТ 7930-73) в Краснодаре,225
Эмаль ЭП-255 бежевая (ГОСТ 23599-79) в Краснодаре,235
Эмаль ЭП-255 салатовая (ГОСТ 23599-79) в Краснодаре,235
Эмаль ЭП-275 чёрная (ГОСТ 23599-79) в Краснодаре,285
Эмаль ЭП-5116 красная (ГОСТ 25366-82) в Краснодаре,210
Эмаль ХВ-714 фисташковая (ГОСТ 23626-79) в Краснодаре,220
Эмаль ЭП-5116 фисташковая (ГОСТ 25366-82) в Краснодаре,210
Эмаль ЭП-255 синяя (ГОСТ 23599-79) в Краснодаре,235
"Эмаль полиуретановая УР-1012 (17,5+2,5) (ТУ 20.30.22-002-83706890-2008) в Краснодаре",415
Эмаль ЭП-439 серая (двухкомпонентная) в Краснодаре,320
Эмаль (Краска) АК-501 в Краснодаре,180
Эмаль алкидно-уретановая в Краснодаре,175
Эмаль ХВ-114 (ТУ 6-10-747-79) в Краснодаре,210
Эмаль ХВ-785 ТУ в Краснодаре,145
Эмаль ЭП-733 1К (ГОСТ 23143-83) в Краснодаре,265
Эмаль КО-198 (ТУ 6-02-841-74) в Краснодаре,180
Эмаль ХС-720 серебристая (ТУ 6-10-708-74) в Краснодаре,240
Эмаль акриловая в Краснодаре,185
Эмаль АУ-1356 (ТУ 20.30.22-002-83706890-2008) в Краснодаре,330
Эмаль ЭП-567 (ГОСТ 22369-77) в Краснодаре,330
Эмаль ХС-119 в Краснодаре,265
Эмаль АС-5305 в Краснодаре,340
Эмаль КО-168 (ТУ 6-02-900-74) в Краснодаре,180
Эмаль АК-1379 в Краснодаре,260
Эмаль ХВ-161 (ТУ 301-10-908-92) в Краснодаре,200
Эмаль ЭП-1267 (ТУ 6-10-2095-87) в Краснодаре,310
Эмаль ХВ-124 ТУ в Краснодаре,145
Эмаль люминисцентная/флюоресцентная в Краснодаре,
Эмаль МЛ-1120 в Краснодаре,265
Эмаль КО-83 серебристая (ГОСТ 23123-78) в Краснодаре,290
Эмаль ХС-416 в Краснодаре,265
Эмаль ХС-527 (ТУ 6-10-1669-78) в Краснодаре,250
Эмаль АУ-1524 в Краснодаре,400
Эмаль МЛ-1150 в Краснодаре,185
Эмаль МЛ-152 в Краснодаре,265
Эмаль ХС-5146 (двухкомпонентная) в Краснодаре,245
Эмаль АУ-1529 серая в Краснодаре,295
Эмаль КО-859 серебристо-серая (ГОСТ 22564-77) в Краснодаре,370
Эмаль КО-834 серебристая в Краснодаре,290
Эмаль ЭП-56 (ТУ 6-10-1243-77) в Краснодаре,290
Эмаль ХВ-16 ТУ в Краснодаре,145
Эмаль УР-11 (ТУ 20.30.22-002-83706890-2008) в Краснодаре,355
Эмаль ЭП-5308 ТУ 6-27-230-2001 в Краснодаре,300
Эмаль ХВ-125 серебристая (ГОСТ 10144-89) в Краснодаре,350
Эмаль НЦ-132 матовая (ТУ) в Краснодаре,175
